{
  "advisory_measurements": {
    "extreme": false,
    "note": "[가설] weighted_char_counts 의 이모지 그래핌 클러스터는 표준 라이브러리 근사다(unicodedata 범주 So + 이모지 블록 · ZWJ·VS16·키캡·피부색·태그 결합 · 지역 표시자 쌍). twitter-text 의 정규식 전체와 갈릴 수 있다 — engine/gate/l0/weighted_length.py",
    "total_words": 361,
    "weighted_char_counts": [
      250,
      254,
      254,
      252,
      254,
      251,
      242,
      245,
      122
    ]
  },
  "checks": [
    {
      "check_id": "gate.input-digest",
      "checked": 6,
      "ruleset": null,
      "ruleset_size": null,
      "ruleset_version": null,
      "status": "pass",
      "vacuous": "none",
      "violations": 0
    },
    {
      "check_id": "run.publish-preconditions",
      "checked": 0,
      "ruleset": null,
      "ruleset_size": null,
      "ruleset_version": null,
      "status": "pass",
      "vacuous": "empty-target",
      "violations": 0
    },
    {
      "check_id": "format.tweet-count",
      "checked": 9,
      "ruleset": null,
      "ruleset_size": null,
      "ruleset_version": null,
      "status": "pass",
      "vacuous": "none",
      "violations": 0
    },
    {
      "check_id": "format.slot-count",
      "checked": 9,
      "ruleset": null,
      "ruleset_size": null,
      "ruleset_version": null,
      "status": "pass",
      "vacuous": "none",
      "violations": 0
    },
    {
      "check_id": "format.body-length",
      "checked": 8,
      "ruleset": null,
      "ruleset_size": null,
      "ruleset_version": null,
      "status": "pass",
      "vacuous": "none",
      "violations": 0
    },
    {
      "check_id": "format.stop-shape",
      "checked": 0,
      "ruleset": null,
      "ruleset_size": null,
      "ruleset_version": null,
      "status": "pass",
      "vacuous": "empty-target",
      "violations": 0
    },
    {
      "check_id": "format.hashtag-zero",
      "checked": 9,
      "ruleset": null,
      "ruleset_size": null,
      "ruleset_version": null,
      "status": "pass",
      "vacuous": "none",
      "violations": 0
    },
    {
      "check_id": "format.no-link-in-body",
      "checked": 8,
      "ruleset": null,
      "ruleset_size": null,
      "ruleset_version": null,
      "status": "pass",
      "vacuous": "none",
      "violations": 0
    },
    {
      "check_id": "format.images-per-post",
      "checked": 9,
      "ruleset": null,
      "ruleset_size": null,
      "ruleset_version": null,
      "status": "pass",
      "vacuous": "none",
      "violations": 0
    },
    {
      "check_id": "annotation.schema",
      "checked": 29,
      "ruleset": null,
      "ruleset_size": null,
      "ruleset_version": null,
      "status": "pass",
      "vacuous": "none",
      "violations": 0
    },
    {
      "check_id": "annotation.missing-tag",
      "checked": 28,
      "ruleset": null,
      "ruleset_size": null,
      "ruleset_version": null,
      "status": "pass",
      "vacuous": "none",
      "violations": 0
    },
    {
      "check_id": "citation.resolve",
      "checked": 80,
      "ruleset": null,
      "ruleset_size": null,
      "ruleset_version": null,
      "status": "pass",
      "vacuous": "none",
      "violations": 0
    },
    {
      "check_id": "numeric.exhaustive",
      "checked": 2,
      "ruleset": null,
      "ruleset_size": null,
      "ruleset_version": null,
      "status": "fail",
      "vacuous": "none",
      "violations": 2
    },
    {
      "check_id": "numeric.unreviewed-use",
      "checked": 2,
      "ruleset": null,
      "ruleset_size": null,
      "ruleset_version": null,
      "status": "pass",
      "vacuous": "none",
      "violations": 0
    },
    {
      "check_id": "strip.roundtrip-forward",
      "checked": 1,
      "ruleset": null,
      "ruleset_size": null,
      "ruleset_version": null,
      "status": "pass",
      "vacuous": "none",
      "violations": 0
    },
    {
      "check_id": "strip.roundtrip-reverse",
      "checked": 1,
      "ruleset": null,
      "ruleset_size": null,
      "ruleset_version": null,
      "status": "pass",
      "vacuous": "none",
      "violations": 0
    },
    {
      "check_id": "strip.reassembly",
      "checked": 1,
      "ruleset": null,
      "ruleset_size": null,
      "ruleset_version": null,
      "status": "pass",
      "vacuous": "none",
      "violations": 0
    },
    {
      "check_id": "strip.residual-tag",
      "checked": 9,
      "ruleset": null,
      "ruleset_size": null,
      "ruleset_version": null,
      "status": "pass",
      "vacuous": "none",
      "violations": 0
    },
    {
      "check_id": "gate.annotation-index",
      "checked": 28,
      "ruleset": null,
      "ruleset_size": null,
      "ruleset_version": null,
      "status": "pass",
      "vacuous": "none",
      "violations": 0
    },
    {
      "check_id": "gate.l0-clean",
      "checked": 1,
      "ruleset": null,
      "ruleset_size": null,
      "ruleset_version": null,
      "status": "fail",
      "vacuous": "none",
      "violations": 1
    },
    {
      "check_id": "gate.no-rewrite",
      "checked": 2,
      "ruleset": null,
      "ruleset_size": null,
      "ruleset_version": null,
      "status": "pass",
      "vacuous": "none",
      "violations": 0
    }
  ],
  "decision": "revise",
  "final_eyes": {
    "inputs_read": [],
    "observations": [],
    "verdict": null,
    "veto_reason": null
  },
  "gate_version": "0.1.0",
  "inactive_layers": [
    {
      "layer": "l1",
      "reason": "재정 T64 ② — 첫 초안 범위 밖 · 소관 M6·M8",
      "ruling": "재정 2026-09-13 T64 ②"
    },
    {
      "layer": "l2",
      "reason": "재정 T64 ② — 첫 초안 범위 밖 · 소관 M6·M8",
      "ruling": "재정 2026-09-13 T64 ②"
    },
    {
      "layer": "speech_act_flag",
      "reason": "재정 T64 ② — 첫 초안 범위 밖 · 소관 M6·M8",
      "ruling": "재정 2026-09-13 T64 ②"
    },
    {
      "layer": "final_eyes",
      "reason": "재정 T64 ② — 첫 초안 범위 밖 · 소관 M6·M8",
      "ruling": "재정 2026-09-13 T64 ②"
    },
    {
      "layer": "format.stop-shape",
      "reason": "재정 T64 ④ 도면 자산층 부재",
      "ruling": "재정 2026-09-13 T64 ④"
    }
  ],
  "l0": {
    "checks": [
      {
        "check_id": "run.publish-preconditions",
        "checked": 0,
        "ruleset": null,
        "ruleset_size": null,
        "ruleset_version": null,
        "status": "pass",
        "vacuous": "empty-target",
        "violations": 0
      },
      {
        "check_id": "format.tweet-count",
        "checked": 9,
        "ruleset": null,
        "ruleset_size": null,
        "ruleset_version": null,
        "status": "pass",
        "vacuous": "none",
        "violations": 0
      },
      {
        "check_id": "format.slot-count",
        "checked": 9,
        "ruleset": null,
        "ruleset_size": null,
        "ruleset_version": null,
        "status": "pass",
        "vacuous": "none",
        "violations": 0
      },
      {
        "check_id": "format.body-length",
        "checked": 8,
        "ruleset": null,
        "ruleset_size": null,
        "ruleset_version": null,
        "status": "pass",
        "vacuous": "none",
        "violations": 0
      },
      {
        "check_id": "format.stop-shape",
        "checked": 0,
        "ruleset": null,
        "ruleset_size": null,
        "ruleset_version": null,
        "status": "pass",
        "vacuous": "empty-target",
        "violations": 0
      },
      {
        "check_id": "format.hashtag-zero",
        "checked": 9,
        "ruleset": null,
        "ruleset_size": null,
        "ruleset_version": null,
        "status": "pass",
        "vacuous": "none",
        "violations": 0
      },
      {
        "check_id": "format.no-link-in-body",
        "checked": 8,
        "ruleset": null,
        "ruleset_size": null,
        "ruleset_version": null,
        "status": "pass",
        "vacuous": "none",
        "violations": 0
      },
      {
        "check_id": "format.images-per-post",
        "checked": 9,
        "ruleset": null,
        "ruleset_size": null,
        "ruleset_version": null,
        "status": "pass",
        "vacuous": "none",
        "violations": 0
      },
      {
        "check_id": "annotation.schema",
        "checked": 29,
        "ruleset": null,
        "ruleset_size": null,
        "ruleset_version": null,
        "status": "pass",
        "vacuous": "none",
        "violations": 0
      },
      {
        "check_id": "annotation.missing-tag",
        "checked": 28,
        "ruleset": null,
        "ruleset_size": null,
        "ruleset_version": null,
        "status": "pass",
        "vacuous": "none",
        "violations": 0
      },
      {
        "check_id": "citation.resolve",
        "checked": 80,
        "ruleset": null,
        "ruleset_size": null,
        "ruleset_version": null,
        "status": "pass",
        "vacuous": "none",
        "violations": 0
      },
      {
        "check_id": "numeric.exhaustive",
        "checked": 2,
        "ruleset": null,
        "ruleset_size": null,
        "ruleset_version": null,
        "status": "fail",
        "vacuous": "none",
        "violations": 2
      },
      {
        "check_id": "numeric.unreviewed-use",
        "checked": 2,
        "ruleset": null,
        "ruleset_size": null,
        "ruleset_version": null,
        "status": "pass",
        "vacuous": "none",
        "violations": 0
      }
    ],
    "defects": [
      {
        "expected": "numeric token in frozen fact set or run whitelist",
        "fix_directive": "T9/S1 의 수치(bare-year)를 동결본 fact 항목으로 재서술하라. 재료에 없는 값이면 문장에서 수치를 제거하라.",
        "id": "d-l0-001",
        "layer": "l0",
        "locus": {
          "sentence": 1,
          "tweet": 9
        },
        "observed": "2024|year",
        "rule": "numeric.exhaustive"
      },
      {
        "expected": "numeric token in frozen fact set or run whitelist",
        "fix_directive": "T9/S1 의 수치(bare-year)를 동결본 fact 항목으로 재서술하라. 재료에 없는 값이면 문장에서 수치를 제거하라.",
        "id": "d-l0-002",
        "layer": "l0",
        "locus": {
          "sentence": 1,